{
    "$id": "https://_schema.outv.im/info-pride/cards",
    "$schema": "http://json-schema.org/draft-07/schema",
    "description": "Card data for wiki.biligame.com/idolypride",
    "required": [
        "长濑麻奈",
        "川咲樱",
        "一之濑怜",
        "佐伯遥子",
        "白石千纱",
        "兵藤雫",
        "长濑琴乃",
        "伊吹渚",
        "白石沙季",
        "成宫铃",
        "早坂芽衣",
        "天动瑠依",
        "铃村优",
        "奥山堇",
        "神崎莉央",
        "井川葵",
        "小美山爱",
        "赤崎心"
    ],
    "title": "The root schema",
    "type": "object",
    "properties": {
        "长濑麻奈": {
            "$ref": "#/$defs/cardGroup"
        },
        "川咲樱": {
            "$ref": "#/$defs/cardGroup"
        },
        "一之濑怜": {
            "$ref": "#/$defs/cardGroup"
        },
        "佐伯遥子": {
            "$ref": "#/$defs/cardGroup"
        },
        "白石千纱": {
            "$ref": "#/$defs/cardGroup"
        },
        "兵藤雫": {
            "$ref": "#/$defs/cardGroup"
        },
        "长濑琴乃": {
            "$ref": "#/$defs/cardGroup"
        },
        "伊吹渚": {
            "$ref": "#/$defs/cardGroup"
        },
        "白石沙季": {
            "$ref": "#/$defs/cardGroup"
        },
        "成宫铃": {
            "$ref": "#/$defs/cardGroup"
        },
        "早坂芽衣": {
            "$ref": "#/$defs/cardGroup"
        },
        "天动瑠依": {
            "$ref": "#/$defs/cardGroup"
        },
        "铃村优": {
            "$ref": "#/$defs/cardGroup"
        },
        "奥山堇": {
            "$ref": "#/$defs/cardGroup"
        },
        "神崎莉央": {
            "$ref": "#/$defs/cardGroup"
        },
        "井川葵": {
            "$ref": "#/$defs/cardGroup"
        },
        "小美山爱": {
            "$ref": "#/$defs/cardGroup"
        },
        "赤崎心": {
            "$ref": "#/$defs/cardGroup"
        }
    },
    "additionalProperties": false,
    "$defs": {
        "cardGroup": {
            "type": "object",
            "title": "Cards from an idol",
            "additionalProperties": {
                "$ref": "#/$defs/card"
            }
        },
        "card": {
            "type": "object",
            "required": [
                "nameJa",
                "nameCn",
                "type",
                "prop",
                "rarity",
                "vocTop",
                "danTop",
                "visTop",
                "staTop",
                "ski1Typ",
                "ski1NameJa",
                "ski1DescJa",
                "ski1NameCn",
                "ski1DescCn",
                "ski2Typ",
                "ski2NameJa",
                "ski2DescJa",
                "ski2NameCn",
                "ski2DescCn",
                "ski3Typ",
                "ski3NameJa",
                "ski3DescJa",
                "ski3NameCn",
                "ski3DescCn"
            ],
            "properties": {
                "type": {
                    "enum": [
                        "支援",
                        "辅助",
                        "得分"
                    ]
                },
                "rarity": {
                    "type": "integer",
                    "minimum": 1,
                    "maximum": 5
                },
                "prop": {
                    "enum": [
                        "舞蹈",
                        "歌唱",
                        "表演"
                    ]
                },
                "ski1Typ": {
                    "enum": [
                        "SP",
                        "A"
                    ]
                },
                "ski2Typ": {
                    "enum": [
                        "A",
                        "P"
                    ]
                },
                "ski3Typ": {
                    "enum": [
                        "A",
                        "P"
                    ]
                },
                "vocTop": {
                    "type": "integer"
                },
                "danTop": {
                    "type": "integer"
                },
                "visTop": {
                    "type": "integer"
                },
                "staTop": {
                    "type": "integer"
                }
            },
            "additionalProperties": true
        }
    }
}